{
  "schema_version": 2,
  "capability_id": "modifier.interaction",
  "kind": "modifier",
  "owner": { "kind": "module", "id": "viewcompose-ui-contract" },
  "artifact": "viewcompose-ui-contract",
  "version_state": { "lane": "released", "version": "0.1.0-alpha04" },
  "symbols": [
    { "symbol_id": "com.viewcompose.ui.modifier.Modifier.clickable", "kind": "extension", "visibility": "public", "source": "viewcompose-ui-contract/src/main/kotlin/com/viewcompose/ui/modifier/ModifierInteractionExtensions.kt" },
    { "symbol_id": "com.viewcompose.ui.modifier.Modifier.interactionIndication", "kind": "extension", "visibility": "public", "source": "viewcompose-ui-contract/src/main/kotlin/com/viewcompose/ui/modifier/ModifierInteractionExtensions.kt" },
    { "symbol_id": "com.viewcompose.ui.modifier.Modifier.contentDescription", "kind": "extension", "visibility": "public", "source": "viewcompose-ui-contract/src/main/kotlin/com/viewcompose/ui/modifier/ModifierInteractionExtensions.kt" },
    { "symbol_id": "com.viewcompose.ui.modifier.Modifier.testTag", "kind": "extension", "visibility": "public", "source": "viewcompose-ui-contract/src/main/kotlin/com/viewcompose/ui/modifier/ModifierInteractionExtensions.kt" }
  ],
  "reference_owner": { "reference_id": "reference.modifier.interaction", "generated": true },
  "sample_owner": { "sample_id": "architecture.modifier-interaction" },
  "document_owners": { "architecture": ["architecture.modifier-runtime"] }
}
