{
  "schema_version": 2,
  "capability_id": "viewmodel.scoped-owners",
  "kind": "integration",
  "owner": { "kind": "module", "id": "viewcompose-viewmodel-androidx" },
  "artifact": "viewcompose-viewmodel-androidx",
  "version_state": { "lane": "released", "version": "0.1.0-alpha01" },
  "symbols": [
    {
      "symbol_id": "com.viewcompose.viewmodel.ViewModelScopeProvider",
      "kind": "type",
      "visibility": "public",
      "source": "viewcompose-viewmodel-androidx/src/main/java/com/viewcompose/viewmodel/ViewModelScopeProvider.kt"
    },
    {
      "symbol_id": "com.viewcompose.viewmodel.ViewModelStoreOwnerLease",
      "kind": "type",
      "visibility": "public",
      "source": "viewcompose-viewmodel-androidx/src/main/java/com/viewcompose/viewmodel/ViewModelScopeProvider.kt"
    },
    {
      "symbol_id": "com.viewcompose.viewmodel.rememberViewModelScopeProvider",
      "kind": "function",
      "visibility": "public",
      "source": "viewcompose-viewmodel-androidx/src/main/java/com/viewcompose/viewmodel/ViewModelScopeComposition.kt"
    },
    {
      "symbol_id": "com.viewcompose.viewmodel.rememberViewModelStoreOwner",
      "kind": "function",
      "visibility": "public",
      "source": "viewcompose-viewmodel-androidx/src/main/java/com/viewcompose/viewmodel/ViewModelScopeComposition.kt"
    }
  ],
  "reference_owner": { "reference_id": "reference.viewmodel.scoped-owners", "generated": true },
  "sample_owner": { "sample_id": "module.viewmodel-scoped-owners" },
  "document_owners": {
    "architecture": ["architecture.retained-viewmodel-scope-ownership"],
    "module": ["module.viewcompose-viewmodel-androidx"],
    "migration": ["migration.compose-host-lifecycle-android-interop"]
  }
}
