{
  "schema_version": 2,
  "capability_id": "viewmodel.store-resolution",
  "kind": "integration",
  "owner": { "kind": "module", "id": "viewcompose-viewmodel-androidx" },
  "artifact": "viewcompose-viewmodel-androidx",
  "version_state": { "lane": "released", "version": "0.1.0-alpha01" },
  "symbols": [
    { "symbol_id": "com.viewcompose.viewmodel.viewModel", "kind": "overload-set", "visibility": "public", "source": "viewcompose-viewmodel-androidx/src/main/java/com/viewcompose/viewmodel/ViewModelComposition.kt" }
  ],
  "reference_owner": { "reference_id": "reference.viewmodel.store-resolution", "generated": true },
  "sample_owner": { "sample_id": "module.viewmodel-resolution" },
  "document_owners": {
    "architecture": ["architecture.navigation-runtime"],
    "module": ["module.viewcompose-viewmodel-androidx"],
    "migration": ["migration.compose-host-lifecycle-android-interop"]
  }
}
