{
  "schema_version": 2,
  "capability_id": "text.input",
  "kind": "dsl",
  "owner": { "kind": "module", "id": "viewcompose-ui-foundation" },
  "artifact": "viewcompose-ui-foundation",
  "version_state": { "lane": "released", "version": "0.1.0-alpha01" },
  "symbols": [
    { "symbol_id": "com.viewcompose.ui.foundation.UiTreeBuilder.BasicTextField", "kind": "overload-set", "visibility": "public", "source": "viewcompose-ui-foundation/src/main/java/com/viewcompose/ui/foundation/dsl/input/TextFieldWidgetsDsl.kt" },
    { "symbol_id": "com.viewcompose.ui.foundation.UiTreeBuilder.TextField", "kind": "overload-set", "visibility": "public", "source": "viewcompose-ui-foundation/src/main/java/com/viewcompose/ui/foundation/dsl/input/TextFieldWidgetsDsl.kt" },
    { "symbol_id": "com.viewcompose.ui.foundation.UiTreeBuilder.SearchBar", "kind": "extension", "visibility": "public", "source": "viewcompose-ui-foundation/src/main/java/com/viewcompose/ui/foundation/dsl/input/SearchBarDsl.kt" }
  ],
  "reference_owner": { "reference_id": "reference.text.input", "generated": true },
  "sample_owner": { "sample_id": "guide.text-input-editing" },
  "document_owners": {
    "module": ["module.viewcompose-text-core", "module.viewcompose-ui-foundation"],
    "tutorial": ["tutorial.text-input"],
    "guide": ["guide.text-input-editing", "guide.text-input-rich-text"],
    "architecture": ["architecture.text-input-runtime"],
    "migration": ["migration.dsl-contract-convergence"]
  }
}
