{
  "schema_version": 2,
  "capability_id": "constraintlayout.helpers",
  "kind": "dsl",
  "owner": { "kind": "module", "id": "viewcompose-constraintlayout-androidx" },
  "artifact": "viewcompose-constraintlayout-androidx",
  "version_state": { "lane": "released", "version": "0.1.0-alpha01" },
  "symbols": [
    { "symbol_id": "com.viewcompose.constraintlayout.ConstraintCircularFlowItem", "kind": "type", "visibility": "public", "source": "viewcompose-constraintlayout-androidx/src/main/java/com/viewcompose/constraintlayout/ConstraintLayoutDsl.kt" },
    { "symbol_id": "com.viewcompose.constraintlayout.ConstraintGridSkip", "kind": "type", "visibility": "public", "source": "viewcompose-constraintlayout-androidx/src/main/java/com/viewcompose/constraintlayout/ConstraintLayoutDsl.kt" },
    { "symbol_id": "com.viewcompose.constraintlayout.ConstraintGridSpan", "kind": "type", "visibility": "public", "source": "viewcompose-constraintlayout-androidx/src/main/java/com/viewcompose/constraintlayout/ConstraintLayoutDsl.kt" },
    { "symbol_id": "com.viewcompose.constraintlayout.ConstraintHelperReference", "kind": "type", "visibility": "public", "source": "viewcompose-constraintlayout-androidx/src/main/java/com/viewcompose/constraintlayout/ConstraintLayoutDsl.kt" },
    { "symbol_id": "com.viewcompose.constraintlayout.ConstraintLayoutScope.createBottomBarrier", "kind": "extension", "visibility": "public", "source": "viewcompose-constraintlayout-androidx/src/main/java/com/viewcompose/constraintlayout/ConstraintLayoutDsl.kt" },
    { "symbol_id": "com.viewcompose.constraintlayout.ConstraintLayoutScope.createCircularFlow", "kind": "extension", "visibility": "public", "source": "viewcompose-constraintlayout-androidx/src/main/java/com/viewcompose/constraintlayout/ConstraintLayoutDsl.kt" },
    { "symbol_id": "com.viewcompose.constraintlayout.ConstraintLayoutScope.createEndBarrier", "kind": "extension", "visibility": "public", "source": "viewcompose-constraintlayout-androidx/src/main/java/com/viewcompose/constraintlayout/ConstraintLayoutDsl.kt" },
    { "symbol_id": "com.viewcompose.constraintlayout.ConstraintLayoutScope.createFlow", "kind": "extension", "visibility": "public", "source": "viewcompose-constraintlayout-androidx/src/main/java/com/viewcompose/constraintlayout/ConstraintLayoutDsl.kt" },
    { "symbol_id": "com.viewcompose.constraintlayout.ConstraintLayoutScope.createGrid", "kind": "extension", "visibility": "public", "source": "viewcompose-constraintlayout-androidx/src/main/java/com/viewcompose/constraintlayout/ConstraintLayoutDsl.kt" },
    { "symbol_id": "com.viewcompose.constraintlayout.ConstraintLayoutScope.createGroup", "kind": "extension", "visibility": "public", "source": "viewcompose-constraintlayout-androidx/src/main/java/com/viewcompose/constraintlayout/ConstraintLayoutDsl.kt" },
    { "symbol_id": "com.viewcompose.constraintlayout.ConstraintLayoutScope.createGuidelineFromBottom", "kind": "extension", "visibility": "public", "source": "viewcompose-constraintlayout-androidx/src/main/java/com/viewcompose/constraintlayout/ConstraintLayoutDsl.kt" },
    { "symbol_id": "com.viewcompose.constraintlayout.ConstraintLayoutScope.createGuidelineFromEnd", "kind": "extension", "visibility": "public", "source": "viewcompose-constraintlayout-androidx/src/main/java/com/viewcompose/constraintlayout/ConstraintLayoutDsl.kt" },
    { "symbol_id": "com.viewcompose.constraintlayout.ConstraintLayoutScope.createGuidelineFromLeft", "kind": "extension", "visibility": "public", "source": "viewcompose-constraintlayout-androidx/src/main/java/com/viewcompose/constraintlayout/ConstraintLayoutDsl.kt" },
    { "symbol_id": "com.viewcompose.constraintlayout.ConstraintLayoutScope.createGuidelineFromRight", "kind": "extension", "visibility": "public", "source": "viewcompose-constraintlayout-androidx/src/main/java/com/viewcompose/constraintlayout/ConstraintLayoutDsl.kt" },
    { "symbol_id": "com.viewcompose.constraintlayout.ConstraintLayoutScope.createGuidelineFromStart", "kind": "extension", "visibility": "public", "source": "viewcompose-constraintlayout-androidx/src/main/java/com/viewcompose/constraintlayout/ConstraintLayoutDsl.kt" },
    { "symbol_id": "com.viewcompose.constraintlayout.ConstraintLayoutScope.createGuidelineFromTop", "kind": "extension", "visibility": "public", "source": "viewcompose-constraintlayout-androidx/src/main/java/com/viewcompose/constraintlayout/ConstraintLayoutDsl.kt" },
    { "symbol_id": "com.viewcompose.constraintlayout.ConstraintLayoutScope.createHorizontalChain", "kind": "extension", "visibility": "public", "source": "viewcompose-constraintlayout-androidx/src/main/java/com/viewcompose/constraintlayout/ConstraintLayoutDsl.kt" },
    { "symbol_id": "com.viewcompose.constraintlayout.ConstraintLayoutScope.createLayer", "kind": "extension", "visibility": "public", "source": "viewcompose-constraintlayout-androidx/src/main/java/com/viewcompose/constraintlayout/ConstraintLayoutDsl.kt" },
    { "symbol_id": "com.viewcompose.constraintlayout.ConstraintLayoutScope.createLeftBarrier", "kind": "extension", "visibility": "public", "source": "viewcompose-constraintlayout-androidx/src/main/java/com/viewcompose/constraintlayout/ConstraintLayoutDsl.kt" },
    { "symbol_id": "com.viewcompose.constraintlayout.ConstraintLayoutScope.createPlaceholder", "kind": "extension", "visibility": "public", "source": "viewcompose-constraintlayout-androidx/src/main/java/com/viewcompose/constraintlayout/ConstraintLayoutDsl.kt" },
    { "symbol_id": "com.viewcompose.constraintlayout.ConstraintLayoutScope.createRightBarrier", "kind": "extension", "visibility": "public", "source": "viewcompose-constraintlayout-androidx/src/main/java/com/viewcompose/constraintlayout/ConstraintLayoutDsl.kt" },
    { "symbol_id": "com.viewcompose.constraintlayout.ConstraintLayoutScope.createStartBarrier", "kind": "extension", "visibility": "public", "source": "viewcompose-constraintlayout-androidx/src/main/java/com/viewcompose/constraintlayout/ConstraintLayoutDsl.kt" },
    { "symbol_id": "com.viewcompose.constraintlayout.ConstraintLayoutScope.createTopBarrier", "kind": "extension", "visibility": "public", "source": "viewcompose-constraintlayout-androidx/src/main/java/com/viewcompose/constraintlayout/ConstraintLayoutDsl.kt" },
    { "symbol_id": "com.viewcompose.constraintlayout.ConstraintLayoutScope.createVerticalChain", "kind": "extension", "visibility": "public", "source": "viewcompose-constraintlayout-androidx/src/main/java/com/viewcompose/constraintlayout/ConstraintLayoutDsl.kt" }
  ],
  "reference_owner": { "reference_id": "reference.constraintlayout.helpers", "generated": true },
  "sample_owner": { "sample_id": "module.constraintlayout-helpers" },
  "document_owners": { "module": ["module.viewcompose-constraintlayout-androidx"] }
}
